### ISSUE TITLE
Dual-stack sfcapd Listener

### ISSUE THREAD

**Issue by phaag** [phaag/nfdump#650]
### Discussed in https://github.com/phaag/nfdump/discussions/649

<div type='discussions-op-text'>

<sup>Originally posted by **bnerickson** December  5, 2025</sup>
Apologies if this has been asked/answered before.

Setup:
OS: Rocky Linux 10.1
Kernel: 6.12.0-124.8.1.el10_1.x86_64
nfdump version: nfdump-1.7.7-1.el10_2.x86_64 / nfdump-libs-1.7.7-1.el10_2.x86_64

Background: I currently use an archaic version of nfsen to parse/display sflow data from Linux machines in LibreNMS.  My environment is dual-stack and I serve up an _sflow SRV DNS record for those hosts to export sflow data to with hsflowd.  sfcapd is running in the background.  Here's a sample of the sfcapd command running on the LibreNMS host:

`/usr/bin/sfcapd -D -p 6343 -u librenms -g librenms -B 200000 -S 1 -P /var/nfsen/var/run/p6343.pid -z -n hostname,192.168.0.97,/opt/librenms/rrd/profiles-data/live/hostname`

Question: Is there any interest in adding simultaneous dual-stack support to sfcapd or would it be too difficult/impossible?  Ideally I'd like to have something like the following running and instead of creating a dummy sflow entry in DNS to only return an A entry for my LibreNMS host I could just point the Linux machines at the LibreNMS A/AAAA entry:

`/usr/bin/sfcapd -4 -6 -D -p 6343 -u librenms -g librenms -B 200000 -S 1 -P /var/nfsen/var/run/p6343.pid -z -n hostnamea,192.168.0.97,fd00::ffff:c0a8:61,/opt/librenms/rrd/profiles-data/live/hostnamea`</div>

**Comment by bnerickson** [comment]
Thank you very much, @phaag .  I went ahead and ran a couple tests and verified that, with no `-4` nor `-6` option the daemon was listening on v4+v6:

```
(0) [12:54:17] [root@librenms:/root]
# ss -l --udp -n | grep 6343
UNCONN 0      0                  *:6343             *:*  
```

Likewise, I confirmed that sfcapd was receiving and processing sflow data received for the same host using two unique IP addresses: one IPv4 and one IPv6:

`/usr/bin/sfcapd -D -p 6343 -u librenms -g librenms -B 200000 -S 1 -P /var/nfsen/var/run/p6343.pid -z -n hostnameB,192.168.0.89,/opt/librenms/rrd/profiles-data/live/hostnameB`:

```
Dec  7 11:15:00 librenms.domain sfcapd[5719]: Ident: 'hostnameB' Flows: 1, Packets: 1000, Bytes: 175000, Sequence Errors: 0, Bad Packets: 0, Blocks: 20
```

`/usr/bin/sfcapd -D -p 6343 -u librenms -g librenms -B 200000 -S 1 -P /var/nfsen/var/run/p6343.pid -z -n hostname,fd00::ffff:c0a8:59,/opt/librenms/rrd/profiles-data/live/hostnameB`

```
Dec  7 13:00:00 librenms.domain sfcapd[22233]: Ident: 'hostnameB Flows: 1, Packets: 1000, Bytes: 126000, Sequence Errors: 0, Bad Packets: 0, Blocks: 21
```

Outstanding: In the original discussion I mentioned (but probably did a poor job of specifying) the ability to specify multiple IP addresses per source ala: `-n hostnameB,192.168.0.89,fd00::ffff:c0a8:59,/opt/librenms/rrd/profiles-data/live/hostnameB`.  Is that out-of-scope of this issue?  As far as I can tell it is unsupported.

**Comment by phaag** [comment]
If we speak about multiple IP addresses, would 2 be ok? (Whatever type of IP) The idea behind the `-n` option is to define a flow source by an IP address - and limit the receiving packets to this IP address - and store all flows in a dedicated directory. Multiple `-n` flow sources may be specified. Each flow source can have multiple exporters as exporting devices, like routers or firewalls may have multiple exporters defined. Would that work?

**Comment by phaag** [comment]
Ohh - there was a typo - now it works.

**Comment by bnerickson** [comment]
That did the trick.  Updated my configs to push from hsflowd over IPv4/IPv6 overnight and it's working perfectly.  Excerpt:

```
$ sudo tcpdump -i any "port 6343" -n
tcpdump: data link type LINUX_SLL2
dropped privs to tcpdump
tcpdump: verbose output suppressed, use -v[v]... for full protocol decode
listening on any, link-type LINUX_SLL2 (Linux cooked v2), snapshot length 262144 bytes
08:15:13.251059 enX0  In  IP 192.168.0.74.46391 > 192.168.0.56.sflow: sFlowv5, IPv4 agent 192.168.0.74, agent-id 100000, length 164
08:15:13.581725 lo    In  IP 192.168.0.56.54867 > 192.168.0.56.sflow: sFlowv5, IPv4 agent 192.168.0.56, agent-id 100000, length 220
08:15:14.241997 enX0  In  IP6 fd00::ffff:c0a8:4b.56737 > fd00::ffff:c0a8:38.sflow: sFlowv5, IPv4 agent 192.168.0.75, agent-id 100000, length 232
08:15:14.257465 enX0  In  IP6 fd00::ffff:c0a8:1.49988 > fd00::ffff:c0a8:38.sflow: sFlowv5, IPv4 agent 192.168.0.1, agent-id 100000, length 164
08:15:14.391931 enX0  In  IP6 fd00::ffff:c0a8:53.39187 > fd00::ffff:c0a8:38.sflow: sFlowv5, IPv4 agent 192.168.0.83, agent-id 100000, length 164
```

I confirmed that the respective IPv4/IPv6 hosts' data is updating successfully in nfsen graphs.  Thanks so much for implementing what amounts to two separate feature requests @phaag !  This is awesome work.  As far as I'm concerned this issue may be closed.
